<?xml version="1.0" encoding="UTF-8"?>
<!-- edited with XMLSpy v2013 (http://www.altova.com) by plouk (plik) -->
<xs:schema xmlns:xs="http://www.w3.org/2001/XMLSchema" elementFormDefault="qualified" attributeFormDefault="unqualified">
	<xs:element name="haricot">
		<xs:annotation>
			<xs:documentation>Comment describing your root element</xs:documentation>
		</xs:annotation>
		<xs:complexType>
			<xs:sequence>
				<xs:element ref="order" minOccurs="0" maxOccurs="unbounded"/>
				<xs:element name="category" maxOccurs="unbounded">
					<xs:complexType>
						<xs:sequence>
							<xs:element name="name"/>
							<xs:element ref="product" minOccurs="0" maxOccurs="unbounded"/>
						</xs:sequence>
						<xs:attribute name="id" type="xs:ID"/>
					</xs:complexType>
				</xs:element>
			</xs:sequence>
		</xs:complexType>
	</xs:element>
	<xs:element name="product">
		<xs:complexType>
			<xs:sequence>
				<xs:element name="name" type="xs:string"/>
				<xs:element name="price" type="xs:double"/>
				<xs:element name="stock_quantity" type="xs:int"/>
				<xs:element name="description" type="xs:string"/>
			</xs:sequence>
			<xs:attribute name="id" type="xs:ID"/>
		</xs:complexType>
	</xs:element>
	<xs:element name="order">
		<xs:complexType>
			<xs:sequence>
				<xs:element name="order_date" type="xs:dateTime"/>
				<xs:element name="confirmation_number" type="xs:string"/>
				<xs:element name="is_shipped" type="xs:boolean" default="false"/>
				<xs:element name="amount" type="xs:double"/>
				<xs:element name="ordered_product">
					<xs:complexType>
						<xs:sequence>
							<xs:element name="product_id" type="xs:IDREF"/>
							<xs:element name="quantity" type="xs:int"/>
						</xs:sequence>
					</xs:complexType>
				</xs:element>
				<xs:element name="customer">
					<xs:complexType>
						<xs:sequence>
							<xs:element name="name" type="xs:string"/>
							<xs:element name="birth_date" type="xs:date"/>
							<xs:element name="address" type="xs:string"/>
						</xs:sequence>
					</xs:complexType>
				</xs:element>
			</xs:sequence>
			<xs:attribute name="id" type="xs:ID"/>
		</xs:complexType>
	</xs:element>
</xs:schema>
